id,idiom,definition,positive,negative,other
529,moment of truth,"A critical or decisive time when you face the reality of a situation, and find out if your efforts have succeeded.",0,40,60
530,move up in the world,To become more important in society or successful in their career.,100,0,0
531,murphy's law,"To express a sentiment of bad luck and the idea that if anything can go wrong, it will.",0,100,0
532,not getting anywhere,To make no progress at all.,0,80,20
533,nothing succeeds like success,The success often leads to further successes.,80,0,20
534,"nothing ventured, nothing gained",You cannot expect to achieve anything if you risk nothing.,20,0,80
535,out of the picture,When people have been eliminated in a contest or tournament.,0,40,60
536,ahead of the pack,When someone is better or more successful than their rivals.,100,0,0
537,pack it in,To abandon it or give it up.,0,100,0
538,pass muster,To be satisfactory or acceptable.,80,0,20
539,on the pig's back,A successful situation and everything is going well for that person.,100,0,0
540,place in the sun,"To reach a position which provides you with success, wealth and/or happiness, or whatever you have been hoping to obtain in life.",100,0,0
541,put the kibosh on,If you do something to prevent a plan or activity from happening or being successful.,0,100,0
542,pyrrhic victory,"A victory that is obtained at a tremendous cost, or causes such a great loss that it is not worth winning.",0,80,20
543,rags to riches,When someone starts off being very poor and become very rich and successful.,100,0,0
544,riding high,Someone who is enjoying a period of success or popularity.,100,0,0
545,rise to the occasion,To manage to do something successfully in difficult circumstances.,100,0,0
546,run rings around,To show much more skill or ability than your opponent.,20,20,60
547,sail through,To succeed in doing it without difficulty.,100,0,0
548,save the day,"If you find a solution to a serious problem, and ensure the success of something that was expected to fail.",100,0,0
549,sink or swim,"Having to do something alone, and their success or failure depends entirely on their own efforts.",0,0,100
550,sky's the limit,There is no limit to the possibility of success or progress for someone or something.,100,0,0
551,smash hit,"A very successful performance in music, films, theatre, etc.",100,0,0
552,snatch victory from the jaws of defeat,"If you manage to win something such as a match or a contest, when you are on the verge of losing.",100,0,0
553,spread oneself too thin,Doing too many things at the same time and can't do any of them well.,0,100,0
554,throw a spanner in the works,To do something that causes problems and prevents the success of a plan or event.,0,100,0
555,throw in the towel,To admit that you cannot succeed.,0,100,0
556,top dog,When someone is more successful or more powerful than others.,100,0,0
557,on the up and up,To become increasingly successful.,100,0,0
558,weather the storm,To succeed in surviving a difficult period or situation.,100,0,0
559,win-win,A situation or proposition where both or all parties benefit from the outcome.,100,0,0
560,wither on the vine,Failing or ceases to exist because people do not support or encourage it.,0,100,0
561,wooden spoon,The person who finishes last in a race or competition receives an imaginary prize.,0,60,40
562,have the world at someone's feet,To be extremely successful and greatly admired.,100,0,0
563,have the world by its tail,To be very successful and has many opportunities to choose from.,100,0,0
564,bolt from the blue,When something happened totally unexpectedly and was a complete surprise.,0,0,100
565,out of the blue,When something happened unexpectedly and causes a surprise.,0,0,100
566,caught unaware,To be surprised and unprepared for what happens.,0,40,60
567,do a double take,To look again in surprise at something unexpected.,0,20,80
568,drop a bombshell,To make an unexpected announcement which will greatly change a situation.,0,0,100
569,eyes on stalks,When your eyes are wide open with surprise or amazement.,0,0,100
570,jaw drop,To show total amazement.,20,0,80
571,jump out of someone's skin,To be extremely surprised or shocked.,0,60,40
572,knock someone's socks off,"If something amazes you, or impresses you greatly.",100,0,0
573,knock down with feather,To emphasize the fact that you were extremely surprised.,0,20,80
574,lo and behold,"To express surprise, especially at a sudden or unexpected appearance.",0,0,100
575,nine-day wonder,"An event which is a nine-day wonder causes interest, surprise or excitement for a short time, but it doesn't last.",20,20,60
576,raise eyebrows,To show surprise or disapproval  by the expression on their face.,0,60,40
577,rooted to the spot,"If you are so shocked, surprised or scared, your reaction is so strong that you are unable to move.",0,40,60
578,seeing is believing,"When you see something that seems incredible you can be sure it exists, or that what you have been told is really true.",20,0,80
579,stop dead in someone's tracks,To stop suddenly because you are totally surprised or frightened.,0,60,40
580,struck dumb,"To be unable to speak because you're are so surprised, shocked or frightened by something.",0,20,80
581,taken unaware,To be suprised because you were not expecting it.,0,40,60
582,there's no accounting for taste,To indicate surprise at another person's likes or dislikes.,0,80,20
583,wonders will never cease,To express pleasure or surprise at something.,80,0,20
584,words fail me,"When someone is so shocked, surprised or touched by something that they don't know what to say.",0,0,100
585,bandit territory,"A geographical area where law enforcement is practically impossible, because people ignore all rule.",0,80,20
586,beat black and blue,If a person is covered with bruise marks caused by being hit.,0,100,0
588,beat the living daylights,To hit someone very hard and repeatedly.,0,100,0
589,come to blows,To start to fight.,0,100,0
590,fight tooth and nail,To fight with energy and determination.,40,0,60
592,free-for-all,This term refers to an uncontrolled situation such as an argument or fight where everyone present can do what they like.,0,40,60
595,tit for tat,This expression refers to an injury or insult given in return for one received.,0,60,40
597,through the wars,"To show signs of rough treatment, injury or damage.",0,100,0
599,in the good books,To have someone's approval.,100,0,0
