id,idiom,definition,positive,negative,other
274,jump for joy,To expresshappiness through excited movements and gestures.,100,0,0
275,life is just a bowl of cherries,This expression means that life is pleasant and uncomplicated.,100,0,0
276,music to someone's ears,When the information that you receive makes you feel very happy.,100,0,0
277,never looked back,"After an event which changed your life for the better, you continue to be happy with the situation.",100,0,0
278,over the moon,To be very happy about something.,100,0,0
280,in raptures,To be delighted or very enthusiastic.,100,0,0
281,stars in someone's eyes,To looking extremely happy.,100,0,0
282,in seventh heaven,To be extremely happy.,100,0,0
283,in stitches,To laugh a lot.,100,0,0
284,thrilled to bits,To be extremely pleased about something.,100,0,0
285,tickled pink,To be very pleased about something.,100,0,0
287,on top of the world,To be extremely happy because everything is going well.,100,0,0
288,walking on air,When you are happy and excited because of a pleasant event that makes you feel as if you are floating.,100,0,0
289,whatever floats someone's boat,"Although you don't quite agree with someone, it's their choice and you think they should so whatever makes them happy.",40,20,40
290,away with the fairies,To be in a dreamy state so that you're not totally in touch with reality and give the impression of being slightly mad.,40,0,60
291,go bananas,If someone becomes very emotional and starts behaving in a crazy way.,0,80,20
292,basket case,A person whose agitated mental state leaves them helpless or unable to cope with things.,0,100,0
293,bats in the belfry,To be crazy.,0,60,40
294,to go out of someone's mind,"To be crazy, foolish or insane.",0,60,40
295,harebrained idea,"An idea or suggestion that is considered to be silly, foolish or totally impractical.",0,100,0
296,"the lights are on, but no one is home","This is a humorous way of referring to someone who is lacking intelligence or sanity, or to someone who is simply preoccupied and not paying attention.",0,60,40
297,lose someone's marbles,"To become mentally confused, or no longer behave sensibly or rationally.",0,60,40
298,not all there,"To behave strangely at times, or seems a bit odd.",0,60,40
299,not in someone's right mind,To not behave in a logical or sensible way.,0,100,0
300,not playing with a full deck (of cards),To lack intelligence or does not have full mental abilities.,0,100,0
301,go nuts,"Someone who has become completely foolish, eccentric or mad.",0,60,40
302,off someone's rocker,Someone who is completely crazy.,0,40,60
303,rats in the attic,Someone who is bit mad or that their behaviour is eccentric.,0,60,40
304,a screw loose,Someone who's behaviour is strange and they appear slightly mad.,0,100,0
305,stark raving mad,Someone whos is completely crazy.,0,60,40
306,stir crazy,Someone who become very agitated or nervous because they have been confined to a place for too long.,0,100,0
307,take leave of someone's senses,To believe someone's behaviour is crazy.,0,80,20
308,back the wrong horse,To support the wrong person.,0,100,0
309,bark up the wrong tree,"To do the wrong thing, because your beliefs or ideas are incorrect or mistaken.",0,80,20
310,botch up/make a botch of,"To spoil something, or make a mess of it, by doing a job badly or incorrectly.",0,100,0
311,eat crow/ eat humble pie,To admit that you were wrong about something and apologize.,20,60,20
312,eat someone's words,To admit that your were mistaken in what you said.,20,40,40
314,himalayan blunder,To stupidly make a serious mistake or error.,0,100,0
315,overshoot the mark,To make a mistake as a result of misjudging something.,0,100,0
316,see the error of someone's ways,To understand that what they have done wrong and accept to change their behaviour.,80,20,0
318,swallow someone's words,To admit that you were wrong.,40,40,20
319,trial and error,Attempting to achieve a satisfactory result by testing and eliminating various methods until the best one is found.,0,0,100
320,wide of the mark,"When something is incorrect or inadequate, or it is not what was expected.",0,60,40
321,black tie event,"A formal event at which men are required to wear a dinner jacket, or tuxedo, and a black bow tie.",0,0,100
322,bow and scrape,To be excessively polite or servile.,40,0,60
323,the done thing,The correct way to behave in a particular social situation.,40,0,60
324,excuse someone's French,An apology for using crude or offensive language.,20,20,60
326,gatecrash,To attend a private social event without being invited.,0,60,40
327,watch someone's language,To warn someone to be careful what they say so as not to upset or offend anyone.,0,60,40
328,mind someone's Ps and Qs,To advise someone to be careful about how they behave and what they say.,20,0,80
329,overstep the mark,To go too far and upset someone by saying something or behaving in a way that is unacceptable.,0,100,0
330,speak out of turn,To intervene at the wrong moment or they say something tactless or inappropriate.,0,100,0
331,stand on ceremony,To behave in a very formal way.,20,0,80
332,take French leave,To leave an official or social event without notifying the person who invited you.,0,80,20
333,time-honoured practice,"A custom that is universally respected, or a traditional way of doing something.",20,0,80
334,achilles heel,"A vulnerable area or a weak spot, in an otherwise strong situation, that could cause one's downfall or failure.",0,100,0
335,alarm bells ringing,"To make someone begin to worry, because it shows that there may be a problem.",0,100,0
336,asking for trouble,To behave so stupidly that he/she is likely to have problems.,0,100,0
337,back to the wall,To be in serious difficulty.,0,100,0
338,ball and chain,A burden or problem that ties you down and prevents you from doing what you want. It can also refer to one's spouse.,0,100,0
339,bane of someone's life,The cause of your problems or your unhappiness.,0,100,0
340,bite off more than someone can chew,"To try to do something that is too difficult for you, or more than you can manage.",0,100,0
341,on the blink,To not work properly and needs servicing or repair.,0,60,40
342,break the back of the beast,To succeed in overcoming a major difficulty.,100,0,0
343,can of worms,"A situation that it is complicated, unpleasant and difficult to deal with.",0,100,0
344,carry the can,"To accept blame or take responsibility for something that goes wrong, even if it is not your fault or only partly.",20,40,40
345,catch 22,"A  frustrating situation where you cannot do one thing without doing a second, and you cannot do the second before doing the first.",0,100,0
346,chill wind,To encounter the problems or trouble it causes.,0,100,0
347,cloud on the horizon,"A problem or difficulty that is predictable, or seems likely to arise in the future.",0,80,20
348,come to a head,A situation reaches a point where action has to be taken.,0,60,40
349,come hell or high water,To do something in spite of the difficulties involved.,60,0,40
350,come out in the wash,To tell someone not to worry about a mistake or problem because it won't have any serious effect and everything will work out all right.,100,0,0
351,cross to bear,To have a serious problem or heavy responsibility that they must accept because they cannot change it.,0,100,0
352,cross that bridge when we come to it,This is another way of saying we will deal with that problem when it occurs and not worry about it before.,40,20,40
353,crux of the matter,The most vital or main part of a problem.,20,0,80
354,dead man walking,"Someone who will inevitably be in great trouble very soon, especially a person who is about to lose their job or position.",0,100,0
355,dodge a bullet,To narrowly avoid a very serious problem or a disaster.,60,20,20
356,elephant in the room,"A problem that no one wants to discuss, but is so abvious that it cannot be ignored.",0,100,0
357,fat hits the fire,"When trouble breaks out, or a situation deteriorates as a result of something said or done.",0,100,0
358,get to the bottom of,You solve it by finding out the true cause of it.,40,0,60
359,go haywire,Where a situation becomes disorganized or goes out of control.,0,100,0
360,go pear-shaped,Where a plan either goes wrong or it produces an undesirable result.,0,100,0
361,go through the mill,"You experience a very difficult period, or are exposed to rough treatment.",0,100,0
362,when the going gets tough,"When faced with a difficult or dangerous situation, strong people take action in order to solve the problem.",40,0,60
363,grasp at straws,"To try any method, even if it has little chance of success, in an attempt to find a solution.",40,60,0
364,hang out to dry,"If you abandon someone who is in difficulty, without giving any assistance or support.",0,100,0
365,high and dry,To find yourself in a difficult situation without help or resources.,0,100,0
366,in dire straits,To be in a very difficult situation.,0,100,0
367,in the lurch,To be in a difficult or embarrassing situation.,0,100,0
368,in over someone's head,To be involved in something that is too difficult for you to handle.,0,100,0
369,juggle frogs,Trying to deal with many different tasks at the tame time and finding the situation difficult.,0,100,0
370,last resort,The last thing you would do if you were desperate and all other courses of action had failed.,0,60,40
371,see light at end of tunnel,To see signs of hope for the future after a long period of difficulty.,100,0,0
372,millstone around someone's neck,A problem or responsibility that becomes a burden and a source of worry.,0,100,0
373,be murder,Something very difficult or uncomfortable.,0,100,0
374,necessary evil,To not like something but you understand that it has to exist and be accepted.,40,60,0
375,one's number is up,"Either a person is in serious difficulty and something bad is going to happen, or the time has come when they will die.",0,100,0
376,ostrich strategy/politics,To choose to ignore or evade an obvious problem in the hope that it will resolve itself or disappear.,20,80,0
377,out of sync,To not be coordinated and are not taking place at the same time or at the same speed.,0,60,40
378,out of whack,Something which does not work properly or is not in good order.,0,100,0
379,paper over the cracks,To conceal a problem rather than dealing with it effectively.,0,100,0
380,pass the buck,To accuse someone of not taking responsibility for a problem and letting others deal with it instead.,0,80,20
381,in a pickle,To be in a difficult situation and need help.,0,100,0
382,quick fix,There is no simple solution.,0,40,60
383,put on a brave face,"When confronted with difficulties, you try to look cheerful and pretend that the situation is not as bad as it is.",60,20,20
384,saved by the bell,When something happens at the last minute to rescue you from a difficult situation.,100,0,0
385,scratch the surface,To deal with only a small part of a problem.,0,40,60
386,where the shoe pinches,An area that is often a source of problems or difficulties.,0,100,0
387,put a spanner in the works,To cause problems and prevent something from happening as planned.,0,100,0
388,spell trouble,To signify possible problems in the future.,0,100,0
389,spiral out of control,"A situation which gets worse or increase continuously, creating a situation that becomes difficult to manage.",0,100,0
390,on a sticky wicket,To find yourself in a situation that is difficult to deal with.,0,100,0
391,stir up a hornet's nest,To do something which causes a commotion and provokes criticism and anger.,0,100,0
392,stop the rot,"When you prevent a situation from deteriorating, especially in business or politics.",80,0,20
393,stumbling block,A problem or obstacle that prevents you from achieving something.,0,100,0
394,take the bull by the horns,When a person decides to act decisively in order to deal with a difficult situation or problem.,80,0,20
395,take the easy way out,"To choose the easiest way to deal with a difficult situation, even if it is not the best solution.",20,40,40
396,tar baby,A sticky situation or problem for which it is virtually impossible to find a solution.,0,100,0
397,teething problems,The difficulties encountered during the initial stage of an activity or project.,0,100,0
398,thorny issue,To deal with a difficult or unpleasant problem.,0,100,0
399,throw money at,"To try to solve a problem by spending money on it, without using any other methods.",0,20,80
400,throw it over the wall,"To deal with part of a problem or project, then pass the responsibility to another person or department without any communication or coordination.",0,80,20
401,tide over,To support someone through a difficult period for a certain length of time.,60,0,40
402,tight spot,To be in a very difficult situation.,0,100,0
403,tip of the iceberg,The part that is known of a problem or situation which is thought to be much more serious.,0,80,20
404,trilemma,"A situation which is even more difficult than a dilemma, because a choice must be made between three options that seem equally undesirable.",0,100,0
405,twist in the wind,To be left to face a difficult situation without any assistance or support.,0,100,0
406,unmitigated disaster,A complete failure or a total catastrophe.,0,100,0
407,uphill battle,A struggle against very unfavourable circumstances.,0,100,0
408,vicious circle,"When the solution to a problem creates another problem similar to the original, or makes it worse, so that the process starts all over again.",0,100,0
409,wave a dead chicken,"When faced with a serious problem, if you take steps that you  know in advance will be futile, to show that you made an effort.",60,20,20
410,wheels fall off,When a situation gets out of control and everything starts to go wrong.,0,100,0
411,without a hitch,"When something takes place exactly as planned, without any difficulties.",100,0,0
412,work cut out for someone,If you have to face a difficult task or a challenging situation.,0,80,20
413,yoke around neck,"An obligation, commitment or restraint that becomes an oppressive burden.",0,100,0
414,batten down the hatches,"To prepare yourself for danger or a forthcoming difficult period, like a ship preparing for a storm.",40,20,40
415,calculated risk,A risk taken with full knowledge of the dangers involved.,40,0,60
416,throw caution to the wind,To start taking risks and stop worrying about the danger involved.,60,0,40
417,close shave,A situation where an accident or a disaster nearly happened.,20,40,40
418,coast is clear,There is no danger in sight or that nobody can see you.,60,0,40
419,cry wolf,To call for help when you are not really in danger.,0,60,40
420,dice with death,If you put your life at risk by doing something very dangerous.,0,100,0
421,dicey situation,Any situation that is potentially risky or dangerous.,0,100,0
422,false move,To do something which may have unpleasant consequences.,0,100,0
423,fraught with danger,An activity or situation that is fraught with danger is full of risks or serious difficulties.,0,80,20
424,by a hair's breadth,To only just manage escape from a danger.,40,0,60
425,hang on for dear life,To be in a dangerous situation and grip something firmly so as not to fall.,0,80,20
426,live to tell the tale,To survive a terrible experience.,60,20,20
427,look before you leap,This is something you say when advising someone to think carefully about the possible dangers before doing something.,20,20,60
428,no-go area,An area where it is dangerous to go.,0,80,20
429,out of harm's way,To put something in a safe place where it won't be damaged.,60,20,20
430,play with fire,People who take unnecessary risks or behave in a dangerous way.,0,80,20
431,put someone's head on the block,If you put yourself in a dangerous situation where you risk losing your job or your reputation if things go wrong.,20,60,20
432,ride it out,"If you manage to survive a dangerous or very unpleasant situation, like a ship sailing through a storm.",80,0,20
433,risk life and limb,To be in danger of death or serious injury.,0,60,40
434,in safe hands,"When something is being looked after by a reliable person or organization, and is therefore at no risk.",100,0,0
435,on the safe side,"To do something as a precaution, to avoid any risks.",60,0,40
436,safety in numbers,When being part of a group makes people feel more secure and more confident when taking action.,80,0,20
437,sail close to the wind,To do something dangerous or act just within the limits of what is legal or acceptable.,0,40,60
438,save someone's neck,To manage to escape from serious danger or trouble.,80,0,20
439,at stake,"Someone who has a lot at stake is in a risky situation, with a lot to be won or lost.",0,60,40
440,take cover,"To hide from a danger, or bad weather, in a place where they find protection.",0,60,40
441,take life in someone's own hands,To take the risk of being killed.,60,0,40
442,watch someone's step,To advise someone to be careful how they behave in order to avoid danger.,0,40,60
443,wrapped up in cotton wool,To be over-protected from dangers and risks.,20,40,40
444,asleep at the wheel,"When someone is not sufficiently attentive, especially at a critical moment when vigilance is required.",0,80,20
445,cat nap,To have a short sleep during the day.,20,0,80
446,forty winks,"To have a short sleep or rest, generally during the day.",20,20,60
447,hit the hay,To go to bed.,20,0,80
448,hit the sack,To go to bed.,0,0,100
449,lie in,To stay in bed after the normal time for getting up.,20,0,80
450,out like a light,To be so tired that you fall asleep very quickly.,20,0,80
451,ready to drop,To be extremely tired and nearly too exhausted to stay standing.,0,80,20
452,sleep like a log,To sleep deeply or soundly.,60,0,40
453,sleep on it,To take time (until the next day) to think something over before making a decision.,20,20,60
454,not sleep a wink,To not sleep a all.,0,40,60
455,not lose any sleep,When something happens that in your opinion is not a cause for worry.,60,0,40
456,sleeping partner,"A person who invests in a business without taking an active part in its management, and whose association with the enterprise is not public knowledge.",0,0,100
457,ace a test,To obtain a very high score or an excellent result.,100,0,0
458,have an ace up someone's sleeve,To have something in reserve with which you can gain an advantage and obtain success.,100,0,0
459,hold all the aces,To be in a very strong position because they have more advantages than anyone else.,100,0,0
460,also-ran,An unsuccessful competitor whose performance is so much poorer than the winner's that it appears insignificant.,0,100,0
461,back to square one,"To not succeeded in what they were trying to do, so they have to start again.",0,100,0
462,in the bag,When it becomes obvious that success or victory is going to be achieved.,100,0,0
463,bear fruit,To produces positive or successful results.,100,0,0
464,up a blind alley,To follow an ineffective course of action which leads nowhere or produces no results.,0,80,20
465,blockbuster,"Something that is outstanding, impressive or particularly successful, such as a film or a book.",100,0,0
466,blow up in face,"When working on a plan or project, if it suddenly goes wrong or fails.",0,100,0
467,bottom fell out,"When something causes a plan, project or venture to collapse or fail.",0,100,0
468,bring the house down,To give a very successful performance.,100,0,0
469,cake not worth the candle,The advantages to be gained from doing something are not worth the effort involved.,0,80,20
470,chance your arm,To decide to do something even though there is little hope of success.,60,0,40
471,had your chips,When someone has completely failed in what they set out to achieve.,0,100,0
472,close but no cigar,An effort to do something which was a good attempt but not quite good enough to succeed.,0,40,60
473,come to grief,"When someone has either had an accident, are destroyed or end in failure.",0,100,0
474,come up in the world,A person who is richer than before and has a higher social status.,100,0,0
475,come up roses,"The end result is successful or positive, even if there were difficult times.",80,0,20
476,turn up trumps,To have achieved unexpectedly good results.,100,0,0
477,cook someone's goose,To spoil that person's chances of success.,0,100,0
478,on course for,"If you are on course for something, you are likely to achieve it.",80,0,20
479,crest of the wave,To be very successful in what you are doing.,100,0,0
480,cut someone's losses,"If you end or withdraw from something that is already failing, in order to reduce the loss of money, time or effort invested in it, you cut your losses.",20,40,40
481,cut someone's own throat,To do something that will be the cause of your own failure or ruin your chances in the future.,0,100,0
482,dead cert,Something that is certain to happen or be achieved.,60,0,40
483,dead duck,A project or scheme which has been abandoned or is certain to fail.,0,100,0
484,dead in the water,A plan at a standstill or has ceased to function and is unlikely to be reactivated in the future.,0,80,20
485,dice are loaded,"If everything seems to work to your disadvantage, and you are not likely to succeed.",0,100,0
486,disaster written all over,"If something, such as a plan or idea, is thought to be heading for complete failure, or will cause a lot of trouble.",0,100,0
487,all downhill,"If something is all downhill or downhill all the way, it is very easy to achieve considering the difficulties encountered beforehand.",60,20,20
488,draw a blank,"If you look for or try to remember something, and draw a blank, you fail to find it.",0,80,20
489,every dog has its day,Where everyone can be successful at something at some time in their life.,80,0,20
490,fall at first hurdle,To fail to overcome the first difficulty encountered.,0,100,0
491,fall flat,"Fails to amuse people, or fails to have the effect that was intended.",0,100,0
492,fall from grace,"To have done something wrong, immoral or unacceptable, and as a result  have lost their good reputation.",0,100,0
493,fall on someone's sword,To accept the consequences of an unsuccessful or wrong action.,20,60,20
494,feather in someone's cap,Proud of something.,100,0,0
495,fight a losing battle,Trying to do something even when there is little chance of succeeding.,20,80,0
496,reach first base,To make progress or begin to have success with someone or something.,100,0,0
497,flash in the pan,Something that it is not likely to be repeated.,0,20,80
498,will never fly,To be unsuccessful.,0,100,0
499,with flying colours,To do something very successfully.,100,0,0
500,flying start,Something immediately becomes successful.,100,0,0
501,fool's errand,"To try to do something which is useless, unnecessary or has no chance of success.",0,100,0
502,foot in the door,When someone has a small but successful start in something and will possibly do well in the future.,100,0,0
503,get a foothold,"To secure a position for yourself in a business, profession or organisation.",100,0,0
504,front runner,"In a contest, race or election, the front runner is the person who is most likely to succeed or win.",80,0,20
505,get the better of someone,If someone or something gets the better of you.,0,100,0
506,go to the dogs,"To say that a company, organization or country is going to the dogs means that it is becoming less successful or efficient than before.",0,100,0
507,go great guns,To be successful or doing very well.,100,0,0
508,go off with a bang,To be very successful.,100,0,0
509,go up in smoke,A plan which fails or ends before producing a result.,0,100,0
510,got it made,Someone who has got it made is so happy and successful in life that they have no worries.,100,0,0
511,hit pay dirt,"If you hit pay dirt, you are lucky and suddenly find yourself in a successful money-making situation.",100,0,0
512,on its knees,"When something such as a country or organization is on its knees, or brought to its knees, it is in a very weak situation or on the verge of failure.",0,100,0
513,landslide victory,The victory of a candidate or a political party by an overwhelming majority is called a landslide victory.,100,0,0
514,lead to a dead end,"If a plan or project leads to a dead end, it develops no further because it has no future.",0,80,20
515,leaps and bounds,To make rapid or spectacular progress or growth.,100,0,0
516,let slip through fingers,To fail to obtain something or keep it.,0,100,0
517,live to fight another day,"Even though you have not been successful, you will have another chance in the future to try again.",100,0,0
518,come a long way,To have made a lot of progress or have become successful.,100,0,0
519,at a low ebb,A person or organization at a low ebb is not as strong or successful as usual.,0,100,0
520,make a comeback,To succeed in returning to their former successful career.,100,0,0
521,make the cut,To reach a required standard or succeed in passing from one round of a competition to another.,80,0,20
522,make a go of,To succeed in your enterprise or produce good results.,100,0,0
523,make headway,To make progress in what you are trying to achieve.,100,0,0
524,make inroads,To advance successfully or make progress.,100,0,0
525,make a killing,To have had great financial success.,100,0,0
526,make or break,Circumstances or events that will make or break someone or something will cause either total success or total ruin.,0,20,80
527,make a pig's ear of,To do a task or a chore very badly or make a complete mess of it.,0,100,0
528,miss the boat,To fail to take advantage of an opportunity because you don't act quickly enough.,0,100,0
